{
  "ok": true,
  "data": {
    "session_id": "sess_00000000000000000000003774",
    "created_at": "2026-07-01T16:04:08Z",
    "updated_at": "2026-07-01T16:04:07.745Z",
    "metadata": {
      "title": "新会话",
      "profile": "chat",
      "archived": false,
      "source": "sidepanel",
      "messageCount": 0,
      "pageRef": {
        "id": "page_bf95bdb0a6ad0305",
        "url": "https://platform.openai.com/?__cf_chl_rt_tk=FPYISHBGQBtRremqU92oLQ9_ZLi_VhcVr.t2eGcdcRo-1782921825-1.0.1.1-8DECdMWy8woPh2mfAfedJRDoiCJIrHFlrkyK3CEDuiI",
        "title": "请稍候…",
        "domain": "platform.openai.com",
        "capturedAt": "2026-07-01T16:04:07.745Z",
        "contentHash": "sha256_bf95bdb0a6ad03054bc01db046c1e19ee86010b979f20fccec0f4945274d416d"
      }
    },
    "activePage": {
      "page_id": "page_bf95bdb0a6ad0305",
      "url": "https://platform.openai.com/?__cf_chl_rt_tk=FPYISHBGQBtRremqU92oLQ9_ZLi_VhcVr.t2eGcdcRo-1782921825-1.0.1.1-8DECdMWy8woPh2mfAfedJRDoiCJIrHFlrkyK3CEDuiI",
      "title": "请稍候…",
      "domain": "platform.openai.com",
      "content_hash": "sha256_bf95bdb0a6ad03054bc01db046c1e19ee86010b979f20fccec0f4945274d416d",
      "captured_at": "2026-07-01T16:04:07.745Z",
      "perception": {
        "structuredPage": {
          "pageId": "page_bf95bdb0a6ad0305",
          "sessionId": "sess_00000000000000000000003774",
          "url": "https://platform.openai.com/?__cf_chl_rt_tk=FPYISHBGQBtRremqU92oLQ9_ZLi_VhcVr.t2eGcdcRo-1782921825-1.0.1.1-8DECdMWy8woPh2mfAfedJRDoiCJIrHFlrkyK3CEDuiI",
          "title": "请稍候…",
          "domain": "platform.openai.com",
          "capturedAt": "2026-07-01T16:04:07.745Z",
          "contentHash": "sha256_bf95bdb0a6ad03054bc01db046c1e19ee86010b979f20fccec0f4945274d416d",
          "metadata": {
            "contentType": "article",
            "wordCount": 385,
            "paragraphCount": 4,
            "headingCount": 0,
            "language": "zh",
            "pageStateHints": [
              "media_dom_limited"
            ],
            "domSignalBlockCount": 1,
            "domSignalLinkCount": 0
          },
          "imageMetadata": [],
          "headingTree": [],
          "paragraphs": [
            {
              "paragraphId": "pg_page_bf95bdb0a6ad0305_0001",
              "pageId": "page_bf95bdb0a6ad0305",
              "order": 0,
              "text": "验证成功。正在等待 platform.openai.com 响应<div class=\"h2\"><span id=\"challenge-error-text\">Enable JavaScript and cookies to continue</span></div>",
              "headingPath": [
                "DOM signals",
                "content_block"
              ],
              "sourceBlockType": "section",
              "selector": "html > body > div.container > div.data:nth-of-type(2) > div.main-wrapper",
              "domSignalRole": "content_block",
              "chunkId": "ck_page_bf95bdb0a6ad0305_0001"
            },
            {
              "paragraphId": "pg_page_bf95bdb0a6ad0305_0002",
              "pageId": "page_bf95bdb0a6ad0305",
              "order": 1,
              "text": "验证成功。正在等待 platform.openai.com 响应<div class=\"h2\"><span id=\"challenge-error-text\">Enable JavaScript and cookies to continue</span></div>(function(){window._cf_chl_opt = {cFPWv: 'g',cH: 'FgBwq4rSZ6uEHr5J2J.heMamkDROsN.5DV1h_5dCq.A-1782921825-1.2.1.1-mCV59qsj2qslGWFwkrisYbbKJBXNK1o5JwfZUQHKMQJNSSYCU.RX1Gn5MvG1_CLT',cITimeS: '1782921825',cRay: 'a146a481fd7de538',cTplB: '0',cTplC:1,cTplO:0,cTplV:5,cType: 'managed',cUPMDTk:\"/?__cf_chl_tk=FPYISHBGQBtRremqU92oLQ9_ZLi_VhcVr.t2eGcdcRo-1782921825-1.0.1.1-8DECdMWy8woPh2mfAfedJRDoiCJIrHFlrkyK3CEDuiI\",cvId: '3',cZone: 'platform.openai.com',fa:\"/?__cf_chl_f_tk=FPYISHBGQBtRremqU92oLQ9_ZLi_VhcVr.t2eGcdcRo-1782921825-1.0.1.1-8DECdMWy8woPh2mfAfedJRDoiCJIrHFlrkyK3CEDuiI\",md: 'G54e6uWqnChGLT8tezeF879hatmrtUfm2ICeJtIpDR4-1782921825-1.2.1.1-0lzxlocymWVSVPI1ZUvrJojtvwbYB0bfL3dSM6MeokeUJNaJjXLiMopr_n0Mxqgpn9KPcHhqGsHxH366_X8jagGIQ9cfz5VDWa3WFGV4oY0ecmHua6V.Z945BsIknH4ahagIrNDc_0reDQwnAlzP2DT9uh6pgw5r7zsbi0G393YjjrL_R_QjVdhOT7sKB89IO8yaDzqGLQqqzbd0m9jLDFc1JvfUwUFgyjtBCtJz0n4L_pkLvk4lxbQEF_difg5r5Ki0y6Z0vOV3HelucvR6fLXSPylHkO30.LY0fx_QyGG4gZ9ArfpmyFbFE7CqunM0KHZx.YzJ0AbmqiKpukOgarmSbED49Qgea6ut_ZXtrPfqK.0M1hll2WFS6seL9WqHALSwNv1X4c7F.2QEzZfqXSBzb7TAjLY8aPXLLv4ib81buV9j7oY_s3e.d3Mi9PVlWQjPTqxU2colBujPvS5ZjFvKlVYvdXlAi_3RRJEcqzJemVJXRjEshbB4ic4dro1K8S3XRpJ.LRR6IV8Fbo31J5FfoXr8iJkTDPHVOUzlFmNlciOKuSPcjW72EOc00Cz68By2l4gOwAZsNXMhXtn2qRROvuZmCqo2OHltg9iTLyhkuw55DqDGdlvrGzz6cp3SSgigQuf8AETsdC9C8cbNiBZAs1fN1s78CTuBAZ7TzdHHW4KNc8xUl2l3THHWG.y7.cmj9SihIo.mgl3Yx57DmBPavYrZlVWmqjvNKTOxvnxLtW89G2AgVc7GdlOeFs0TxE.c6Yiy97axUySOMNUs.CEOGEd8BH9ybhsQB9dSh8_geo2N10_w45DGya2NE6QnnvOID2k8jL0Up87Qw.BJYzc_ga.Ka7dBJVr5EHRxuBafDnlg0uPOKiylUdQeTKVnpjw3O3wRlAGwlFezNibFYbBup_3RFe.Ggdw8_Rpp9oxMAfyr5dokpF2aS.GWb.zuzGFqwKzO97gyJX6a_YH8t0njKDqyXsOE6ZNNJ_TkHF3tzcCcuRaEIXQpU7vWeL5grjTXuaR9rbHxloxc2PoeAYZmRmseqhCN.4OSepNb9d..gXLUEV04V.2WqwwZA6mNla6a_u02SCDJtHRv7oYJJrkR7_ML13a4ED93qsmG7ICz9Pq5SW1kZg1tHIEY91qIMJ53WHXfz_xy9cu0O6rV3t_NA6HIF4hcizf5Lf8QRWw',mdrd: 'C4Qqw_AVZO1y4zuAq3Uxc2NXRputUZw5c3HkVI17Jv0-1782921825-1.2.1.1-KAkVGzx_wSZCDrXKRJq21RClOVBrJJYJljOpHry4_nUcOwk0iqbmPw0yN8SvvH2mqJdBTaWby8G6sip8XDF7WPfwkLyjUatdB4NWI.VTYvJSWE4pAI1sqLOOntxxGStoCCUzxOftGOViL5GhoZQbJQKySESSl8uphytwEUfoxhkzFg.3fYAQAvEMyTM1tdYFB5DwzV1Fv2y.1w_2XcKQNZtToF8yKXEHM1pVVdnown0NEoCp_73poB0l_WwKeGlub2OdMmkX4_074opldP8r7VjQ_hAOMUSkfQpqCRBWuLJbrXbCJdvuGQ2waE4KhsQVHNzfR4Eo_e_cKszx4rww_HnxZVt1VoEf1ty",
              "headingPath": [],
              "sourceBlockType": "paragraph",
              "chunkId": "ck_page_bf95bdb0a6ad0305_0002"
            },
            {
              "paragraphId": "pg_page_bf95bdb0a6ad0305_0003",
              "pageId": "page_bf95bdb0a6ad0305",
              "order": 2,
              "text": "'#' : location.hash;window._cf_chl_opt.cOgUQuery = location.search === '' && location.href.slice(0, location.href.length - window._cf_chl_opt.cOgUHash.length).indexOf('?') !== -1 ?",
              "headingPath": [],
              "sourceBlockType": "paragraph",
              "chunkId": "ck_page_bf95bdb0a6ad0305_0003"
            },
            {
              "paragraphId": "pg_page_bf95bdb0a6ad0305_0004",
              "pageId": "page_bf95bdb0a6ad0305",
              "order": 3,
              "text": "'?' : location.search;if (window.history && window.history.replaceState) {var ogU = location.pathname + window._cf_chl_opt.cOgUQuery + window._cf_chl_opt.cOgUHash;history.replaceState(null, null,\"/?__cf_chl_rt_tk=FPYISHBGQBtRremqU92oLQ9_ZLi_VhcVr.t2eGcdcRo-1782921825-1.0.1.1-8DECdMWy8woPh2mfAfedJRDoiCJIrHFlrkyK3CEDuiI\"+ window._cf_chl_opt.cOgUHash);a.onload = function() {history.replaceState(null, null, ogU);}}document.getElementsByTagName('head')[0].appendChild(a);}()); !function(){var e=document.createElement(\"iframe\");function n(){var n=e.contentDocument||e.contentWindow.document;if(n){var t=n.createElement(\"script\");t.nonce=\"\",t.innerHTML=\"window['__CF$cv$params']={r:'792f8224776acf9f',m:'hMcSCCrnIkr7c8Pec6Na6boaaFAnQ6S0ypG2GKRbKgc-1675305063-0-AaJn0SqKZQnadmRQ5O1dM9xMkXWyP+ll7gpl2NHeoNbZTEXMjlB10KkwnEU3hf0/gMODfKqcBGLVecql6U04GGs+iJ/kNrNqj1FgfAOlQV+T2koMQMvUy1zr9tegBBX6BikfccHZhwoJhnXc0eTcg58=',s:[0x60b082f691,0xee65a67e11],u:'/cdn-cgi/challenge-platform/h/b'};var now=Date.now()/1000,offset=14400,ts=''+(Math.floor(now)-Math.floor(now%offset)),_cpo=document.createElement('script');_cpo.nonce='',_cpo.src='/cdn-cgi/challenge-platform/h/b/scripts/alpha/invisible.js?ts='+ts,document.getElementsByTagName('head')[0].appendChild(_cpo);\",n.getElementsByTagName(\"head\")[0].appendChild(t)}}if(e.height=1,e.width=1,e.style.position=\"absolute\",e.style.top=0,e.style.left=0,e.style.border=\"none\",e.style.visibility=\"hidden\",document.body.appendChild(e),\"loading\"!==document.readyState)n();else if(window.addEventListener)document.addEventListener(\"DOMContentLoaded\",n);else{var t=document.onreadystatechange||function(){};document.onreadystatechange=function(e){t(e),\"loading\"!==document.readyState&&(document.onreadystatechange=t,n())}}}();",
              "headingPath": [],
              "sourceBlockType": "paragraph",
              "chunkId": "ck_page_bf95bdb0a6ad0305_0004"
            }
          ],
          "chunks": [
            {
              "chunkId": "ck_page_bf95bdb0a6ad0305_0001",
              "pageId": "page_bf95bdb0a6ad0305",
              "headingPath": [
                "DOM signals",
                "content_block"
              ],
              "text": "验证成功。正在等待 platform.openai.com 响应<div class=\"h2\"><span id=\"challenge-error-text\">Enable JavaScript and cookies to continue</span></div>",
              "tokenEstimate": 33,
              "order": 0,
              "paragraphIds": [
                "pg_page_bf95bdb0a6ad0305_0001"
              ],
              "chunk_id": "ck_page_bf95bdb0a6ad0305_0001",
              "page_id": "page_bf95bdb0a6ad0305",
              "heading_path": [
                "DOM signals",
                "content_block"
              ],
              "token_estimate": 33
            },
            {
              "chunkId": "ck_page_bf95bdb0a6ad0305_0002",
              "pageId": "page_bf95bdb0a6ad0305",
              "headingPath": [],